{"schema_version":"cognitive-runtime.authority-candidate/v2","candidate_id":"candidate-synthetic","revision":1,"candidate_type":"semantic","stable_id":"sem-synthetic","base_authority_version":null,"base_checksum":null,"content":{"title":"Synthetic"},"source_map":[{"source_ref":"src-synthetic-note","content_path":"body"}],"exact_diff":"+ Synthetic","checksum":"sha256:0000000000000000000000000000000000000000000000000000000000000000","created_at":"2026-08-14T01:00:00Z"}
